{
  "id": "wsdot-us395-mp188-1-loon-lake-summit-3",
  "name": "US 395 at MP 188.1: Loon Lake Summit (3)",
  "lat": 48.028583,
  "lon": -117.598056,
  "feed_url": "https://images.wsdot.wa.gov/rweather/ClaytonRd2.jpg",
  "feed_type": "image",
  "source": "WSDOT",
  "status": "approved",
  "approved_by": "codingwithchad",
  "page_url": "https://wsdot.com/travel/real-time/map/",
  "embed_mode": "direct",
  "refresh_seconds": 120,
  "tags": [
    "road"
  ],
  "attribution_text": "Washington State Department of Transportation",
  "created_at": "2026-10-07T00:00:00Z",
  "route": "US 395",
  "milepost": 188.1
}
