{
  "id": "wsdot-sr531-mp8-5-67th-ave-ne",
  "name": "SR 531 at MP 8.5: 67th Ave. NE",
  "lat": 48.151907,
  "lon": -122.140593,
  "feed_url": "https://images.wsdot.wa.gov/nw/531vc00859.jpg",
  "feed_type": "image",
  "source": "WSDOT",
  "status": "approved",
  "approved_by": "codingwithchad",
  "page_url": "https://wsdot.com/travel/real-time/map/",
  "embed_mode": "direct",
  "refresh_seconds": 120,
  "tags": [
    "road"
  ],
  "attribution_text": "Washington State Department of Transportation",
  "created_at": "2026-10-07T00:00:00Z",
  "route": "SR 531",
  "milepost": 8.5
}
