{
  "id": "odot-us97-at-shaniko-nb",
  "name": "US97 at Shaniko NB",
  "lat": 45.00614,
  "lon": -120.75247,
  "feed_url": "https://www.TripCheck.com/roadcams/cams/US97%20at%20Shaniko%20NB_pid4341.jpg",
  "feed_type": "image",
  "source": "ODOT",
  "status": "approved",
  "approved_by": "codingwithchad",
  "page_url": "https://tripcheck.com/",
  "embed_mode": "direct",
  "refresh_seconds": 300,
  "tags": [
    "road"
  ],
  "attribution_text": "Oregon Department of Transportation (TripCheck)",
  "created_at": "2026-10-09T00:00:00Z",
  "route": "US 97",
  "milepost": 56.36
}
