{
  "id": "wsdot-i90-mp296-liberty-lake-4",
  "name": "I-90 at MP 296: Liberty Lake (4)",
  "lat": 47.670525,
  "lon": -117.111317,
  "feed_url": "https://images.wsdot.wa.gov/rweather/LibertyLake3.jpg",
  "feed_type": "image",
  "source": "WSDOT",
  "status": "approved",
  "approved_by": "codingwithchad",
  "page_url": "https://wsdot.com/travel/real-time/map/",
  "embed_mode": "direct",
  "refresh_seconds": 120,
  "tags": [
    "road"
  ],
  "attribution_text": "Washington State Department of Transportation",
  "created_at": "2026-10-07T00:00:00Z",
  "route": "I 90",
  "milepost": 296
}
