{
  "id": "wsdot-wsf-kingston-ferry-sign-west",
  "name": "WSF Kingston Ferry Sign West",
  "lat": 47.80941,
  "lon": -122.52564,
  "feed_url": "https://images.wsdot.wa.gov/wsf/kingston/fsw/fsw.jpg",
  "feed_type": "image",
  "source": "WSDOT",
  "status": "approved",
  "approved_by": "codingwithchad",
  "page_url": "https://wsdot.com/travel/real-time/map/",
  "embed_mode": "direct",
  "refresh_seconds": 120,
  "tags": [
    "ferry"
  ],
  "attribution_text": "Washington State Department of Transportation",
  "created_at": "2026-10-07T00:00:00Z"
}
