{
  "id": "wsdot-us2-mp45-6-skykomish",
  "name": "US 2 at MP 45.6 (Skykomish)",
  "lat": 47.732568,
  "lon": -121.417381,
  "feed_url": "https://images.wsdot.wa.gov/nw/002vc04558.jpg",
  "feed_type": "image",
  "source": "WSDOT",
  "status": "approved",
  "approved_by": "codingwithchad",
  "page_url": "https://wsdot.com/travel/real-time/mountainpasses/stevens",
  "route": "US 2",
  "embed_mode": "direct",
  "refresh_seconds": 120,
  "tags": [
    "road",
    "stevens-pass"
  ],
  "attribution_text": "Washington State Department of Transportation",
  "created_at": "2026-10-07T00:00:00Z",
  "milepost": 45.6
}
