{
  "id": "wsdot-wsf-coupeville-terminal",
  "name": "WSF Coupeville Terminal",
  "lat": 48.159349,
  "lon": -122.672701,
  "feed_url": "https://images.wsdot.wa.gov/wsf/Keystone/terminal/keyterm.jpg",
  "feed_type": "image",
  "source": "WSDOT",
  "status": "approved",
  "approved_by": "codingwithchad",
  "page_url": "https://wsdot.com/travel/real-time/map/",
  "embed_mode": "direct",
  "refresh_seconds": 120,
  "tags": [
    "ferry"
  ],
  "attribution_text": "Washington State Department of Transportation",
  "created_at": "2026-10-07T00:00:00Z"
}
