{
  "id": "odot-washington-county-175th-ave-at-rigert-rd",
  "name": "Washington County - 175th Ave at Rigert Rd",
  "lat": 45.46191,
  "lon": -122.85711,
  "feed_url": "https://www.TripCheck.com/roadcams/cams/175th%20Ave%20at%20Rigert%20Rd_pid4525.jpg",
  "feed_type": "image",
  "source": "ODOT",
  "status": "approved",
  "approved_by": "codingwithchad",
  "page_url": "https://tripcheck.com/",
  "embed_mode": "direct",
  "refresh_seconds": 300,
  "tags": [
    "road"
  ],
  "attribution_text": "Oregon Department of Transportation (TripCheck)",
  "created_at": "2026-10-09T00:00:00Z",
  "route": "CNTY",
  "milepost": 0
}
