{
  "id": "odot-i-5-at-n-phoenix-rd-fern-valley",
  "name": "I-5 at N. Phoenix Rd. (Fern Valley)",
  "lat": 42.28123,
  "lon": -122.81531,
  "feed_url": "https://www.TripCheck.com/roadcams/cams/I-5%20at%20N.%20Phoenix%20Rd.%20%28Fern%20Valley%29_pid3375.JPG",
  "feed_type": "image",
  "source": "ODOT",
  "status": "approved",
  "approved_by": "codingwithchad",
  "page_url": "https://tripcheck.com/",
  "embed_mode": "direct",
  "refresh_seconds": 300,
  "tags": [
    "road"
  ],
  "attribution_text": "Oregon Department of Transportation (TripCheck)",
  "created_at": "2026-10-09T00:00:00Z",
  "route": "I 5",
  "milepost": 24.4
}
