{
  "id": "odot-or138-at-marvin-hill-539",
  "name": "OR138 at Marvin Hill",
  "lat": 43.45894,
  "lon": -123.4357,
  "feed_url": "https://www.TripCheck.com/roadcams/cams/Marvin%20Hill%20WB_pid2609.JPG",
  "feed_type": "image",
  "source": "ODOT",
  "status": "approved",
  "approved_by": "codingwithchad",
  "page_url": "https://tripcheck.com/",
  "embed_mode": "direct",
  "refresh_seconds": 300,
  "tags": [
    "road"
  ],
  "attribution_text": "Oregon Department of Transportation (TripCheck)",
  "created_at": "2026-10-09T00:00:00Z",
  "route": "OR 138",
  "milepost": 16.7
}
