{
  "id": "odot-or126-at-central-rd",
  "name": "OR126 at Central Rd",
  "lat": 44.05271,
  "lon": -123.29306,
  "feed_url": "https://www.TripCheck.com/roadcams/cams/ORE126%20at%20Central%20Rd%20EB_pid4558.jpg",
  "feed_type": "image",
  "source": "ODOT",
  "status": "approved",
  "approved_by": "codingwithchad",
  "page_url": "https://tripcheck.com/",
  "embed_mode": "direct",
  "refresh_seconds": 300,
  "tags": [
    "road"
  ],
  "attribution_text": "Oregon Department of Transportation (TripCheck)",
  "created_at": "2026-10-09T00:00:00Z",
  "route": "OR 126",
  "milepost": 49.69
}
