{
  "id": "wsdot-i5-mp194-everett-ave",
  "name": "I-5 at MP 194: Everett Ave",
  "lat": 47.982248,
  "lon": -122.185935,
  "feed_url": "https://images.wsdot.wa.gov/nw/005vc19406.jpg",
  "feed_type": "image",
  "source": "WSDOT",
  "status": "approved",
  "approved_by": "codingwithchad",
  "page_url": "https://wsdot.com/travel/real-time/map/",
  "embed_mode": "direct",
  "refresh_seconds": 120,
  "tags": [
    "road"
  ],
  "attribution_text": "Washington State Department of Transportation",
  "created_at": "2026-10-07T00:00:00Z",
  "route": "I 5",
  "milepost": 194
}
