{
  "id": "wsdot-i205-mp32-9-south-of-padden-parkway",
  "name": "I-205 at MP 32.9: South of Padden Parkway",
  "lat": 45.682033,
  "lon": -122.592433,
  "feed_url": "https://images.wsdot.wa.gov/sw/205vc03295.jpg",
  "feed_type": "image",
  "source": "WSDOT",
  "status": "approved",
  "approved_by": "codingwithchad",
  "page_url": "https://wsdot.com/travel/real-time/map/",
  "embed_mode": "direct",
  "refresh_seconds": 120,
  "tags": [
    "road"
  ],
  "attribution_text": "Washington State Department of Transportation",
  "created_at": "2026-10-07T00:00:00Z",
  "route": "I 205",
  "milepost": 32.9
}
