{
  "id": "wsdot-i5-mp114-1-nisqually",
  "name": "I-5 at MP 114.1: Nisqually",
  "lat": 47.067634,
  "lon": -122.715485,
  "feed_url": "https://images.wsdot.wa.gov/orflow/005vc11410.jpg",
  "feed_type": "image",
  "source": "WSDOT",
  "status": "approved",
  "approved_by": "codingwithchad",
  "page_url": "https://wsdot.com/travel/real-time/map/",
  "embed_mode": "direct",
  "refresh_seconds": 120,
  "tags": [
    "road"
  ],
  "attribution_text": "Washington State Department of Transportation",
  "created_at": "2026-10-07T00:00:00Z",
  "route": "I 5",
  "milepost": 114.1
}
