{
  "id": "wsdot-i5-mp275-5-mitchell-ave",
  "name": "I-5 at MP 275.5: Mitchell Ave",
  "lat": 48.99155,
  "lon": -122.742222,
  "feed_url": "https://images.wsdot.wa.gov/nw/005vc27556.jpg",
  "feed_type": "image",
  "source": "WSDOT",
  "status": "approved",
  "approved_by": "codingwithchad",
  "page_url": "https://wsdot.com/travel/roads-bridges/border-crossings",
  "embed_mode": "direct",
  "refresh_seconds": 120,
  "tags": [
    "border",
    "road"
  ],
  "attribution_text": "Washington State Department of Transportation",
  "created_at": "2026-10-07T00:00:00Z",
  "route": "I 5",
  "milepost": 275.5
}
