{
  "id": "odot-portland-82nd-ave-at-division-st",
  "name": "Portland - 82nd Ave at Division St",
  "lat": 45.5048,
  "lon": -122.57866,
  "feed_url": "https://www.TripCheck.com/roadcams/cams/ORE213%20at%20Division%20St_pid2684.JPG",
  "feed_type": "image",
  "source": "ODOT",
  "status": "approved",
  "approved_by": "codingwithchad",
  "page_url": "https://tripcheck.com/",
  "embed_mode": "direct",
  "refresh_seconds": 300,
  "tags": [
    "road"
  ],
  "attribution_text": "Oregon Department of Transportation (TripCheck)",
  "created_at": "2026-10-09T00:00:00Z",
  "route": "OR 213",
  "milepost": 4.22
}
