{
  "id": "carson-south-elk-ridge-golf-course",
  "name": "Carson – South: Elk Ridge Golf Course",
  "lat": 45.7279,
  "lon": -121.80186,
  "feed_type": "image",
  "source": "elkridgegolfcourse.com via Windy.com",
  "status": "approved",
  "approved_by": "codingwithchad",
  "provider": "windy",
  "provider_ref": "1678128472",
  "embed_mode": "direct",
  "refresh_seconds": 300,
  "page_url": "https://windy.com/webcams/1678128472",
  "tags": [
    "columbia-gorge"
  ],
  "attribution_text": "elkridgegolfcourse.com via Windy.com",
  "created_at": "2026-10-09T00:00:00Z"
}
