{
  "id": "wsdot-sr9-mp17-5-sr-92-interchange",
  "name": "SR 9 at MP 17.5: SR 92 Interchange",
  "lat": 48.028186,
  "lon": -122.110248,
  "feed_url": "https://images.wsdot.wa.gov/nw/009vc01751.jpg",
  "feed_type": "image",
  "source": "WSDOT",
  "status": "approved",
  "approved_by": "codingwithchad",
  "page_url": "https://wsdot.com/travel/real-time/map/",
  "embed_mode": "direct",
  "refresh_seconds": 120,
  "tags": [
    "road"
  ],
  "attribution_text": "Washington State Department of Transportation",
  "created_at": "2026-10-07T00:00:00Z",
  "route": "SR 9",
  "milepost": 17.5
}
