{
  "id": "wsdot-aviation-chewelah-municipal-airport",
  "name": "Chewelah Municipal Airport",
  "lat": 48.314,
  "lon": -117.74333,
  "feed_url": "https://images.wsdot.wa.gov/airports/ChewelahN.jpg",
  "feed_type": "image",
  "source": "WSDOT Aviation",
  "status": "approved",
  "approved_by": "codingwithchad",
  "page_url": "https://wsdot.wa.gov/travel/aviation/airports-list",
  "embed_mode": "direct",
  "refresh_seconds": 120,
  "tags": [
    "airfield",
    "airport",
    "airfield-chewelah-municipal-airport"
  ],
  "attribution_text": "WSDOT Aviation (pictures are for pilots, not an official weather briefing)",
  "created_at": "2026-10-07T00:00:00Z"
}
