{
  "id": "wsdot-sr18-mp13-2-se-256th-st-eb-ramps",
  "name": "SR 18 at MP 13.2: SE 256th St, EB Ramps",
  "lat": 47.372661,
  "lon": -122.091288,
  "feed_url": "https://images.wsdot.wa.gov/nw/018vc01316.jpg",
  "feed_type": "image",
  "source": "WSDOT",
  "status": "approved",
  "approved_by": "codingwithchad",
  "page_url": "https://wsdot.com/travel/real-time/map/",
  "embed_mode": "direct",
  "refresh_seconds": 120,
  "tags": [
    "road"
  ],
  "attribution_text": "Washington State Department of Transportation",
  "created_at": "2026-10-07T00:00:00Z",
  "route": "SR 18",
  "milepost": 13.2
}
