{
  "id": "wsdot-i205-mp29-7-burton-rd",
  "name": "I-205 at MP 29.7: Burton Rd",
  "lat": 45.642218,
  "lon": -122.563993,
  "feed_url": "https://images.wsdot.wa.gov/sw/205vc02976.jpg",
  "feed_type": "image",
  "source": "WSDOT",
  "status": "approved",
  "approved_by": "codingwithchad",
  "page_url": "https://wsdot.com/travel/real-time/map/",
  "embed_mode": "direct",
  "refresh_seconds": 120,
  "tags": [
    "road"
  ],
  "attribution_text": "Washington State Department of Transportation",
  "created_at": "2026-10-07T00:00:00Z",
  "route": "I 205",
  "milepost": 29.7
}
