{
  "id": "wsdot-sr525-mp6-9-76th-st-sw-south-wsf-mukilteo",
  "name": "SR 525 at MP 6.9: 76th St SW South - WSF Mukilteo",
  "lat": 47.92825,
  "lon": -122.300562,
  "feed_url": "https://images.wsdot.wa.gov/nw/525vc00694.jpg",
  "feed_type": "image",
  "source": "WSDOT",
  "status": "approved",
  "approved_by": "codingwithchad",
  "page_url": "https://wsdot.com/travel/real-time/map/",
  "route": "SR 525",
  "embed_mode": "direct",
  "refresh_seconds": 120,
  "tags": [
    "road",
    "ferry",
    "mukilteo"
  ],
  "attribution_text": "Washington State Department of Transportation",
  "created_at": "2026-10-07T00:00:00Z",
  "milepost": 6.9
}
